{
  "id": "dungeon",
  "label": "Dungeon",
  "gb_tileset_kind": "WORLD_TILESET_DUNGEON",
  "tiles": [
    { "id": "floor_basic", "label": "Dungeon Floor", "gb_constant": "TILE_DUNGEON_FLOOR", "gb_tile_index": 0, "walkable": true, "color": "#88c070", "ascii": "." },
    { "id": "wall_vertical", "label": "Dungeon Wall Vertical", "gb_constant": "TILE_DUNGEON_WALL", "gb_tile_index": 1, "walkable": false, "color": "#205838", "ascii": "#" },
    { "id": "wall_horizontal", "label": "Dungeon Wall Horizontal", "gb_constant": "TILE_DUNGEON_WALL", "gb_tile_index": 2, "walkable": false, "color": "#205838", "ascii": "#" },
    { "id": "wall_corner_tl", "label": "Dungeon Wall Corner TL", "gb_constant": "TILE_DUNGEON_WALL", "gb_tile_index": 3, "walkable": false, "color": "#205838", "ascii": "l" },
    { "id": "wall_corner_tr", "label": "Dungeon Wall Corner TR", "gb_constant": "TILE_DUNGEON_WALL", "gb_tile_index": 4, "walkable": false, "color": "#205838", "ascii": "j" },
    { "id": "wall_corner_bl", "label": "Dungeon Wall Corner BL", "gb_constant": "TILE_DUNGEON_WALL", "gb_tile_index": 5, "walkable": false, "color": "#205838", "ascii": "b" },
    { "id": "wall_corner_br", "label": "Dungeon Wall Corner BR", "gb_constant": "TILE_DUNGEON_WALL", "gb_tile_index": 6, "walkable": false, "color": "#205838", "ascii": "d" },
    { "id": "crack_fine", "label": "Dungeon Crack Fine", "gb_constant": "TILE_DUNGEON_CRACK", "gb_tile_index": 7, "walkable": false, "color": "#704820", "ascii": "." },
    { "id": "crack_coarse", "label": "Dungeon Crack Coarse", "gb_constant": "TILE_DUNGEON_CRACK", "gb_tile_index": 8, "walkable": false, "color": "#704820", "ascii": "#" },
    { "id": "pillar_ns", "label": "Dungeon Pillar N-S", "gb_constant": "TILE_DUNGEON_PILLAR", "gb_tile_index": 9, "walkable": false, "color": "#704820", "ascii": "I" },
    { "id": "pillar_ew", "label": "Dungeon Pillar E-W", "gb_constant": "TILE_DUNGEON_PILLAR", "gb_tile_index": 10, "walkable": false, "color": "#704820", "ascii": "T" },
    { "id": "arch_north", "label": "Dungeon Arch North", "gb_constant": "TILE_DUNGEON_ARCH", "gb_tile_index": 11, "walkable": true, "color": "#e0f8d0", "ascii": ">" },
    { "id": "arch_south", "label": "Dungeon Arch South", "gb_constant": "TILE_DUNGEON_ARCH", "gb_tile_index": 12, "walkable": true, "color": "#e0f8d0", "ascii": "<" },
    { "id": "arch_east", "label": "Dungeon Arch East", "gb_constant": "TILE_DUNGEON_ARCH", "gb_tile_index": 13, "walkable": true, "color": "#e0f8d0", "ascii": "^" },
    { "id": "arch_west", "label": "Dungeon Arch West", "gb_constant": "TILE_DUNGEON_ARCH", "gb_tile_index": 14, "walkable": true, "color": "#e0f8d0", "ascii": "v" },
    { "id": "brick_tl", "label": "Dungeon Brick TL", "gb_constant": "TILE_DUNGEON_WALL", "gb_tile_index": 15, "walkable": false, "color": "#704820", "ascii": "p" },
    { "id": "brick_tr", "label": "Dungeon Brick TR", "gb_constant": "TILE_DUNGEON_WALL", "gb_tile_index": 16, "walkable": false, "color": "#704820", "ascii": "q" },
    { "id": "brick_bl", "label": "Dungeon Brick BL", "gb_constant": "TILE_DUNGEON_WALL", "gb_tile_index": 17, "walkable": false, "color": "#704820", "ascii": "b" },
    { "id": "brick_br", "label": "Dungeon Brick BR", "gb_constant": "TILE_DUNGEON_WALL", "gb_tile_index": 18, "walkable": false, "color": "#704820", "ascii": "d" },
    { "id": "solid_wall", "label": "Dungeon Solid Wall", "gb_constant": "TILE_DUNGEON_SOLID", "gb_tile_index": 19, "walkable": false, "color": "#000000", "ascii": "#" },
    { "id": "floor_stone", "label": "Dungeon Stone Floor", "gb_constant": "TILE_DUNGEON_FLOOR", "gb_tile_index": 20, "walkable": true, "color": "#88c070", "ascii": "." },
    { "id": "floor_dirt", "label": "Dungeon Dirt Floor", "gb_constant": "TILE_DUNGEON_FLOOR", "gb_tile_index": 21, "walkable": true, "color": "#88c070", "ascii": "." },
    { "id": "wall_grate", "label": "Dungeon Grate Wall", "gb_constant": "TILE_DUNGEON_WALL", "gb_tile_index": 22, "walkable": true, "color": "#e0f8d0", "ascii": "." },
    { "id": "door_vertical", "label": "Dungeon Door Vertical", "gb_constant": "TILE_DUNGEON_WALL", "gb_tile_index": 23, "walkable": false, "color": "#205838", "ascii": "|" },
    { "id": "door_horizontal", "label": "Dungeon Door Horizontal", "gb_constant": "TILE_DUNGEON_WALL", "gb_tile_index": 24, "walkable": false, "color": "#205838", "ascii": "-" },
    { "id": "window_small", "label": "Dungeon Small Window", "gb_constant": "TILE_DUNGEON_WALL", "gb_tile_index": 25, "walkable": true, "color": "#e0f8d0", "ascii": "." },
    { "id": "window_large", "label": "Dungeon Large Window", "gb_constant": "TILE_DUNGEON_WALL", "gb_tile_index": 26, "walkable": true, "color": "#e0f8d0", "ascii": "." },
    { "id": "floor_mossy", "label": "Dungeon Mossy Floor", "gb_constant": "TILE_DUNGEON_FLOOR", "gb_tile_index": 27, "walkable": true, "color": "#88c070", "ascii": "." }
  ]
}