{
  "id": "exterior",
  "label": "Exterior / Overworld",
  "gb_tileset_kind": "WORLD_TILESET_EXTERIOR",
  "tiles": [
    {
      "id": "floor",
      "label": "Floor / Grass",
      "gb_constant": "TILE_FLOOR",
      "gb_tile_index": 0,
      "walkable": true,
      "color": "#88c070",
      "ascii": "."
    },
    {
      "id": "wall",
      "label": "Wall / Mountain",
      "gb_constant": "TILE_WALL",
      "gb_tile_index": 1,
      "walkable": false,
      "color": "#346856",
      "ascii": "#"
    },
    {
      "id": "gate",
      "label": "Gate / Exit",
      "gb_constant": "TILE_EXIT",
      "gb_tile_index": 2,
      "walkable": true,
      "color": "#e0f8d0",
      "ascii": ">"
    },
    {
      "id": "building",
      "label": "Building",
      "gb_constant": "TILE_BUILDING",
      "gb_tile_index": 3,
      "walkable": false,
      "color": "#081820",
      "ascii": "B"
    }
  ]
}
