{
  "id": "interior",
  "label": "Interior / Castle",
  "gb_tileset_kind": "WORLD_TILESET_INTERIOR",
  "tiles": [
    {
      "id": "floor",
      "label": "Floor / Flagstone",
      "gb_constant": "TILE_FLOOR",
      "gb_tile_index": 0,
      "walkable": true,
      "color": "#88c070",
      "ascii": "."
    },
    {
      "id": "wall",
      "label": "Wall / Dungeon Wall",
      "gb_constant": "TILE_WALL",
      "gb_tile_index": 1,
      "walkable": false,
      "color": "#346856",
      "ascii": "#"
    },
    {
      "id": "door",
      "label": "Door / Exit",
      "gb_constant": "TILE_EXIT",
      "gb_tile_index": 2,
      "walkable": true,
      "color": "#e0f8d0",
      "ascii": ">"
    },
    {
      "id": "building",
      "label": "Prop / Pillar",
      "gb_constant": "TILE_BUILDING",
      "gb_tile_index": 3,
      "walkable": false,
      "color": "#081820",
      "ascii": "B"
    }
  ]
}
